Entity,Definition,Images
Breathing,"Breathing (or ventilation) is the process of moving air into and from the lungs to facilitate gas exchange with the internal environment, mostly to flush out carbon dioxide and bring in oxygen.","['https://upload.wikimedia.org/wikipedia/commons/9/9d/Altitude_and_air_pressure_%26_Everest.jpg', 'https://upload.wikimedia.org/wikipedia/commons/9/9c/Austrian_Future_Cup_2018-11-24_Group_3_Rotation_3_Parallel_bars_%28Martin_Rulsch%29_056.jpg', 'https://upload.wikimedia.org/wikipedia/commons/1/1b/Bak%C3%B3_%C3%81rp%C3%A1d_-_Milagro_%28Santana_Tribute%29_egy%C3%BCttes%2C_Miskolc%2C_2015.02.07_%288%29.JPG', 'https://upload.wikimedia.org/wikipedia/commons/0/0c/Breathing_Resistance.svg', 'https://upload.wikimedia.org/wikipedia/commons/8/88/Breathing_abnormalities.svg']"
Recycling,Recycling is the process of converting waste materials into new materials and objects.,"['https://upload.wikimedia.org/wikipedia/commons/1/11/ACT_recycling_truck.jpg', 'https://upload.wikimedia.org/wikipedia/commons/b/bf/Aegopodium_podagraria1_ies.jpg', 'https://upload.wikimedia.org/wikipedia/commons/b/ba/Agbogbloshie_Ghana.jpg', 'https://upload.wikimedia.org/wikipedia/commons/3/3a/Automat_do_przyjmowania_butelek_zwrotnych_w_60-tysi%C4%99cznym_Tomaszowie_Mazowieckim_Warszawska_r%C3%B3g_Szerokiej.jpg', 'https://upload.wikimedia.org/wikipedia/commons/3/3a/Bedrijfsafval.jpg']"
Cyclone,"In meteorology, a cyclone ()  is a large air mass that rotates around a strong center of low atmospheric pressure, counterclockwise in the Northern Hemisphere and clockwise in the Southern Hemisphere as viewed from above (opposite to an anticyclone).","['https://upload.wikimedia.org/wikipedia/commons/c/c6/2017_Atlantic_hurricane_season_summary_map.png', 'https://upload.wikimedia.org/wikipedia/commons/c/cc/Alex_2016-01-13_1530Z.jpg', 'https://upload.wikimedia.org/wikipedia/commons/1/1a/Baroclinicleafphasecyclogenesiscropped.png', 'https://upload.wikimedia.org/wikipedia/commons/1/1a/Baroclinicleafphasecyclogenesiscropped.png', 'https://upload.wikimedia.org/wikipedia/commons/4/4a/Commons-logo.svg']"
Gas pipe,Not found on Wikipedia,['Image not found']
Mango,A mango is an edible stone fruit produced by the tropical tree Mangifera indica.,"['https://upload.wikimedia.org/wikipedia/commons/c/c6/%27Himsagar%27_mango_stone_%28seed%29.jpg', 'https://upload.wikimedia.org/wikipedia/commons/8/81/09251jfFilipino_foods_fruits_Bulacan_landmarksfvf_37.jpg', 'https://upload.wikimedia.org/wikipedia/commons/f/fb/Carabao_mangoes_%28Philippines%29.jpg', 'https://upload.wikimedia.org/wikipedia/commons/8/84/Coat_of_arms_of_the_Philippines.svg', 'https://upload.wikimedia.org/wikipedia/commons/4/4a/Commons-logo.svg']"
Covid-19,Not found on Wikipedia,['Image not found']
City,A city is a human settlement of notable size.,"['https://upload.wikimedia.org/wikipedia/commons/3/3d/10_mile_panorama_of_NYC%2C_Feb.%2C_2018.jpg', 'https://upload.wikimedia.org/wikipedia/commons/2/26/1_rocinha_night_2014_panorama_%28vertical_cropped%29.jpg', 'https://upload.wikimedia.org/wikipedia/commons/3/3d/2006megacities.svg', 'https://upload.wikimedia.org/wikipedia/commons/6/63/AcueductoSegovia04.JPG', 'https://upload.wikimedia.org/wikipedia/commons/8/83/Aftermath_of_a_huge_fire_at_Thomas_McKenzie_%26_Sons_Ltd._on_Pearse_Street%2C_Dublin.jpg']"
Unicellular organism,"A unicellular organism, also known  as a single-celled organism, is an organism that consists of a single cell, unlike a multicellular organism that consists of multiple cells.","['https://upload.wikimedia.org/wikipedia/commons/a/a1/CSIRO_ScienceImage_7632_SEM_diatom.jpg', 'https://upload.wikimedia.org/wikipedia/commons/1/1f/Echinoderms_600.jpg', 'https://upload.wikimedia.org/wikipedia/commons/2/29/Kg3.jpg', 'https://upload.wikimedia.org/wikipedia/commons/4/4c/Paramecia_tetraurelia.jpeg', 'https://upload.wikimedia.org/wikipedia/commons/1/1b/Stromatolites_in_Sharkbay.jpg']"
Fruit,"In botany, a fruit is the seed-bearing structure in flowering plants that is formed from the ovary after flowering.","['https://upload.wikimedia.org/wikipedia/commons/d/de/Bananavarieties.jpg', 'https://upload.wikimedia.org/wikipedia/commons/2/2f/Blackberryraspberrystrawberry.jpg', 'https://upload.wikimedia.org/wikipedia/commons/4/4a/Commons-logo.svg', 'https://upload.wikimedia.org/wikipedia/commons/0/0e/DewberriesWeb.jpg', 'https://upload.wikimedia.org/wikipedia/commons/d/d6/Foodlogo2.svg']"
Crop damage,Not found on Wikipedia,['Image not found']
Chemical process,"In a scientific sense, a chemical process is a method or means of somehow changing one or more chemicals or chemical compounds.","['https://upload.wikimedia.org/wikipedia/commons/d/db/Haber-Bosch-En.svg', 'https://upload.wikimedia.org/wikipedia/commons/8/81/PlatformHolly.jpg', 'https://upload.wikimedia.org/wikipedia/commons/9/99/Question_book-new.svg', 'https://upload.wikimedia.org/wikipedia/commons/9/96/Symbol_category_class.svg', 'https://upload.wikimedia.org/wikipedia/commons/e/e2/Symbol_portal_class.svg']"
Development,Development or developing may refer to:,"['https://upload.wikimedia.org/wikipedia/commons/5/5f/Disambig_gray.svg', 'https://upload.wikimedia.org/wikipedia/commons/9/99/Wiktionary-logo-en-v2.svg']"
Xylem,"Xylem is one of the two types of transport tissue in vascular plants, the other being phloem.","['https://upload.wikimedia.org/wikipedia/commons/9/96/Banded_tube.jpg', 'https://upload.wikimedia.org/wikipedia/commons/4/4a/Commons-logo.svg', 'https://upload.wikimedia.org/wikipedia/commons/e/e6/Ficusxylem.jpg', 'https://upload.wikimedia.org/wikipedia/commons/8/8a/OOjs_UI_icon_edit-ltr-progressive.svg', 'https://upload.wikimedia.org/wikipedia/commons/3/34/Pressurebomb.svg']"
Biochemical cycle,Not found on Wikipedia,['Image not found']
Work,Work may refer to: ,"['https://upload.wikimedia.org/wikipedia/commons/5/5f/Disambig_gray.svg', 'https://upload.wikimedia.org/wikipedia/commons/f/fa/Wikiquote-logo.svg', 'https://upload.wikimedia.org/wikipedia/commons/9/99/Wiktionary-logo-en-v2.svg']"
Jewellery,"Jewellery (Commonwealth English) or jewelry (American English) consists of decorative items worn for personal adornment, such as brooches, rings, necklaces, earrings, pendants, bracelets, and cufflinks.","['https://upload.wikimedia.org/wikipedia/commons/2/2c/A002.jpg', 'https://upload.wikimedia.org/wikipedia/commons/8/85/Anillo_de_Sheshonq_%2846627183381%29.jpg', 'https://upload.wikimedia.org/wikipedia/commons/e/eb/Archaeological_museum%2C_Athens_%284976534238%29.jpg', 'https://upload.wikimedia.org/wikipedia/commons/a/a5/Atsidi_Sani.jpg', 'https://upload.wikimedia.org/wikipedia/commons/5/56/BOG_04_2012_Museo_de_Oro_1213.JPG']"
Pet,"A pet, or companion animal, is an animal kept primarily for a person's company or entertainment rather than as a working animal, livestock, or a laboratory animal.","['https://upload.wikimedia.org/wikipedia/commons/1/10/Antoinette_Metayer_%281732-88%29._Oudste_zuster_van_Louis_Metayer_Rijksmuseum_SK-A-2140.jpeg', 'https://upload.wikimedia.org/wikipedia/commons/a/af/Big_single-family_home_2.jpg', 'https://upload.wikimedia.org/wikipedia/commons/3/3b/Black_Labrador_Retriever_-_Male_IMG_3323_%28cropped%29.jpg', 'https://upload.wikimedia.org/wikipedia/commons/d/d8/Black_cat_-_Sydney.jpg', 'https://upload.wikimedia.org/wikipedia/commons/8/8b/Boerendeel_Rijksmuseum_SK-C-540.jpeg']"
Rigidity,Rigid or rigidity may refer to:,"['https://upload.wikimedia.org/wikipedia/commons/5/5f/Disambig_gray.svg', 'https://upload.wikimedia.org/wikipedia/commons/9/99/Wiktionary-logo-en-v2.svg']"
Queensland,"Queensland (locally  KWEENZ-land) is a state situated in northeastern Australia, and is the second-largest and third-most populous of the Australian states.","['https://upload.wikimedia.org/wikipedia/commons/b/bb/Australia_states_and_territories_labelled.svg', 'https://upload.wikimedia.org/wikipedia/commons/4/46/BinnaBurra5.JPG', 'https://upload.wikimedia.org/wikipedia/commons/e/e0/Brisbane_City_Skyline.jpg', 'https://upload.wikimedia.org/wikipedia/commons/9/98/Bulla_Queensland_1861.jpg', 'https://upload.wikimedia.org/wikipedia/commons/c/ca/Captain_Cook_at_Possession_Island.jpg']"
Liquor,"Liquor ( LIK-ər) is an alcoholic drink produced by distillation of grains, fruits, vegetables, or sugar, that have already gone through alcoholic fermentation.","['https://upload.wikimedia.org/wikipedia/commons/2/21/17-05-06-Miniaturen_RR79033.jpg', 'https://upload.wikimedia.org/wikipedia/commons/2/28/Alcohol_belts_of_Europe_%28actual_consumption_in_2016%29.svg', 'https://upload.wikimedia.org/wikipedia/commons/5/52/Bar_Hard_Rock_Cafe_Prague.png', 'https://upload.wikimedia.org/wikipedia/commons/e/e1/Brewing_and_distillation_industries._%28_1858-_%29.jpg', 'https://upload.wikimedia.org/wikipedia/commons/4/4a/Commons-logo.svg']"
Multicellular organism,"A multicellular organism is an organism that consists of more than one cell, in contrast to  unicellular organism.","['https://upload.wikimedia.org/wikipedia/commons/7/77/C_elegans_stained.jpg', 'https://upload.wikimedia.org/wikipedia/commons/5/5c/ColonialFlagellateHypothesis.png', 'https://upload.wikimedia.org/wikipedia/commons/9/96/Symbol_category_class.svg', 'https://upload.wikimedia.org/wikipedia/commons/e/e2/Symbol_portal_class.svg', 'https://upload.wikimedia.org/wikipedia/commons/c/cd/The-Simplest-Integrated-Multicellular-Organism-Unveiled-pone.0081641.s003.ogv']"
Decomposition,"Decomposition or rot is the process by which dead organic substances are broken down into simpler organic or inorganic matter such as carbon dioxide, water, simple sugars and mineral salts.","['https://upload.wikimedia.org/wikipedia/commons/9/9c/A_punnet_of_rotten_peaches.jpg', 'https://upload.wikimedia.org/wikipedia/commons/3/30/Ants_cleaning_dead_snake.jpg', 'https://upload.wikimedia.org/wikipedia/commons/5/53/Berge_naturreservat_omkullfallet_liten_tall.jpg', 'https://upload.wikimedia.org/wikipedia/commons/4/4a/Commons-logo.svg', 'https://upload.wikimedia.org/wikipedia/commons/2/27/DecayingPeachSmall.gif']"
Vegetable,Vegetables are parts of plants that are consumed by humans or other animals as food.,"['https://upload.wikimedia.org/wikipedia/commons/3/33/7carrots.jpg', 'https://upload.wikimedia.org/wikipedia/commons/7/7c/AUSAID_SOUTH_AFRICA_%2810672860713%29.jpg', 'https://upload.wikimedia.org/wikipedia/commons/f/fb/Aubergine.jpg', 'https://upload.wikimedia.org/wikipedia/commons/f/f1/Bean_field_Seabrook_Farm1a33785v.jpg', 'https://upload.wikimedia.org/wikipedia/commons/d/db/Bohne_z01.JPG']"
Plant,"Plants are predominantly photosynthetic eukaryotes, forming the kingdom Plantae.","['https://upload.wikimedia.org/wikipedia/commons/1/16/160_Ranunculus_repens.jpg', 'https://upload.wikimedia.org/wikipedia/commons/8/80/Alternation_of_generations_simpler.svg', 'https://upload.wikimedia.org/wikipedia/commons/2/2f/Asterophyllites_Equisetiformis.jpg', 'https://upload.wikimedia.org/wikipedia/commons/1/14/Barbara_McClintock_%281902-1992%29_shown_in_her_laboratory_in_1947.jpg', 'https://upload.wikimedia.org/wikipedia/commons/5/50/California_Arena_Point_fern.jpg']"
Plate boundary,Not found on Wikipedia,['Image not found']
Mizanur Rahman Khan,Mizanur Rahman Khan (October 1967 – 11 January 2021) was a Bangladeshi journalist.,"['https://upload.wikimedia.org/wikipedia/commons/f/f9/Flag_of_Bangladesh.svg', 'https://upload.wikimedia.org/wikipedia/commons/c/c4/Quill_and_ink.svg']"
Galaxy science,Not found on Wikipedia,['Image not found']
African Plate,The African Plate is a major tectonic plate that includes much of the continent of Africa (except for its easternmost part) and the adjacent oceanic crust to the west and south.,"['https://upload.wikimedia.org/wikipedia/commons/1/10/AfricanPlate.png', 'https://upload.wikimedia.org/wikipedia/commons/4/4a/Commons-logo.svg', 'https://upload.wikimedia.org/wikipedia/commons/b/b4/Motion_of_Nubia_Plate.gif', 'https://upload.wikimedia.org/wikipedia/commons/9/96/Symbol_category_class.svg', 'https://upload.wikimedia.org/wikipedia/commons/d/db/Symbol_list_class.svg']"
Minerals,Not found on Wikipedia,['Image not found']
Head,"A head is the part of an organism which usually includes the ears, brain, forehead, cheeks, chin, eyes, nose, and mouth, each of which aid in various sensory functions such as sight, hearing, smell, and taste.","['https://upload.wikimedia.org/wikipedia/commons/a/ab/Andrea_Vaccaro%2C_T%C3%AAte_de_Saint-Jean_Baptiste.jpg', 'https://upload.wikimedia.org/wikipedia/commons/1/1f/Bartholin_head_transect.jpg', 'https://upload.wikimedia.org/wikipedia/commons/2/20/Beethovendeathmask.jpg', 'https://upload.wikimedia.org/wikipedia/commons/4/4a/Commons-logo.svg', 'https://upload.wikimedia.org/wikipedia/commons/4/4e/Domenico_Beccafumi_-_T%C3%AAte_de_jeune_homme.jpg']"
Quebec,Quebec ( k(w)ih-BEK; French: Québec [kebɛk] (listen)) is one of the thirteen provinces and territories of Canada.,"['https://upload.wikimedia.org/wikipedia/commons/b/bd/Ambox_current_red_Asia_Australia.svg', 'https://upload.wikimedia.org/wikipedia/commons/d/d5/Apollo_11_Lunar_Module_Eagle_in_landing_configuration_in_lunar_orbit_from_the_Command_and_Service_Module_Columbia.jpg', 'https://upload.wikimedia.org/wikipedia/commons/b/b1/Baie-Saint-Paul.jpg', 'https://upload.wikimedia.org/wikipedia/commons/c/cf/Bombardier_CSeries_mockup.jpg', 'https://upload.wikimedia.org/wikipedia/commons/2/2c/Boston_vs._CH_au_Centre_Bell_007.jpg']"
Noun,"A noun (from Latin  nōmen 'name') is a word that generally functions as the name of a specific object or set of objects, such as living creatures, places, actions, qualities, states of existence, or ideas.Lexical categories (parts of speech) are defined in terms of the ways in which their members combine with other kinds of expressions.","['https://upload.wikimedia.org/wikipedia/commons/8/8a/OOjs_UI_icon_edit-ltr-progressive.svg', 'https://upload.wikimedia.org/wikipedia/commons/9/99/Question_book-new.svg', 'https://upload.wikimedia.org/wikipedia/commons/9/99/Wiktionary-logo-en-v2.svg']"
Weakly bound atom,Not found on Wikipedia,['Image not found']
2.Nucleus,Not found on Wikipedia,['Image not found']
Reverse process,Not found on Wikipedia,['Image not found']
Gastric ulcer,Not found on Wikipedia,['Image not found']
Shade,"Shade, Shades or Shading may refer to:","['https://upload.wikimedia.org/wikipedia/commons/5/5f/Disambig_gray.svg', 'https://upload.wikimedia.org/wikipedia/commons/9/99/Wiktionary-logo-en-v2.svg']"
Building material,Building material is material used for construction.,"['https://upload.wikimedia.org/wikipedia/commons/1/1f/2008_BeaconHill_Boston_2302897829.jpg', 'https://upload.wikimedia.org/wikipedia/commons/a/a5/20130816_Belfry_of_St_Laurentius_Ahrweiler.jpg', 'https://upload.wikimedia.org/wikipedia/commons/d/da/Assentamento_com_argamassa_polim%C3%A9rica.JPG', 'https://upload.wikimedia.org/wikipedia/commons/e/e0/Bodruzal_cerkov06017008.JPG', 'https://upload.wikimedia.org/wikipedia/commons/8/85/Celotex_thermax_foamed_plastic_sheets.jpg']"
Bile duct,"A bile duct is any of a number of long tube-like structures that carry bile, and is present in most vertebrates.","['https://upload.wikimedia.org/wikipedia/commons/5/5e/3DPrinted_biliary_system_20151201.jpg', 'https://upload.wikimedia.org/wikipedia/commons/1/14/Biliary_system_multilingual.svg', 'https://upload.wikimedia.org/wikipedia/commons/4/4c/Choledochojejunstomy_diagram.svg', 'https://upload.wikimedia.org/wikipedia/commons/4/4a/Commons-logo.svg', 'https://upload.wikimedia.org/wikipedia/commons/9/96/Digestive_system_showing_bile_duct.svg']"
Carbon dioxide,Carbon dioxide (chemical formula CO2) is a chemical compound made up of molecules that each have one carbon atom covalently double bonded to two oxygen atoms.,"['https://upload.wikimedia.org/wikipedia/commons/6/63/Apollo13_apparatus.jpg', 'https://upload.wikimedia.org/wikipedia/commons/6/61/Auto-and_heterotrophs.png', 'https://upload.wikimedia.org/wikipedia/commons/0/0f/Buckminsterfullerene-perspective-3D-balls.png', 'https://upload.wikimedia.org/wikipedia/commons/e/e1/CC_BY_icon.svg', 'https://upload.wikimedia.org/wikipedia/commons/e/e1/CC_BY_icon.svg']"
Magnet,A magnet is a material or object that produces a magnetic field.,"['https://upload.wikimedia.org/wikipedia/commons/2/28/Ceramic_magnets.jpg', 'https://upload.wikimedia.org/wikipedia/commons/4/4a/Commons-logo.svg', 'https://upload.wikimedia.org/wikipedia/commons/7/7a/Hard_disk.jpg', 'https://upload.wikimedia.org/wikipedia/commons/7/70/M_tic.jpg', 'https://upload.wikimedia.org/wikipedia/commons/5/57/Magnet0873.png']"
Buenos Aires,"Buenos Aires ( or ; Spanish pronunciation: [ˈbwenos ˈajɾes] (listen)), officially the Autonomous City of Buenos Aires (Spanish: Ciudad Autónoma de Buenos Aires), is the capital and primate city of Argentina.","['https://upload.wikimedia.org/wikipedia/commons/a/ab/200_Series_at_San_Jos%C3%A9_de_Flores.jpg', 'https://upload.wikimedia.org/wikipedia/commons/f/fe/A_View_of_the_Obelisk%2C_in_Buenos_Aires%2C_Argentina%2C_the_Host_Site_for_the_2018_G-20_Leaders%27_Summit_%2846114415381%29.jpg', 'https://upload.wikimedia.org/wikipedia/commons/c/c4/Av._de_Mayo_y_Lima_%28ca._1915%29.JPG', 'https://upload.wikimedia.org/wikipedia/commons/7/7e/BAFWEEK_planetario.jpg', 'https://upload.wikimedia.org/wikipedia/commons/9/90/Banco_Naci%C3%B3n_%281416694260%29_Buenos_Aires%2C_Argentina.jpg']"
Fart,Not found on Wikipedia,['https://upload.wikimedia.org/wikipedia/commons/1/1b/Semi-protection-shackle.svg']
Endemic species,Not found on Wikipedia,['Image not found']
Structural damage,Not found on Wikipedia,['Image not found']
Iodine,Iodine is a chemical element with the symbol I and atomic number 53.,"['https://upload.wikimedia.org/wikipedia/commons/b/b4/Base-centered_orthorhombic.svg', 'https://upload.wikimedia.org/wikipedia/commons/1/15/Carte_iodurie_france_%C2%B5g_par_jour_d%27apr%C3%A8s_Mornex_1987_Le_Guen_2000.jpg', 'https://upload.wikimedia.org/wikipedia/commons/4/4a/Commons-logo.svg', 'https://upload.wikimedia.org/wikipedia/commons/1/1c/Diatrizoic_acid.svg', 'https://upload.wikimedia.org/wikipedia/commons/c/c3/GHS-pictogram-exclam.svg']"
South America,"South America is a continent entirely in the Western Hemisphere and mostly in the Southern Hemisphere, with a relatively small portion in the Northern Hemisphere at the northern tip of the continent.","['https://upload.wikimedia.org/wikipedia/commons/b/bd/0200_years_Biblioteca_Nacional_in_Rio_de_Janeiro_city.jpg', 'https://upload.wikimedia.org/wikipedia/commons/7/7f/2016_fachada_columnas_Teatro_Sol%C3%ADs_de_Montevideo.jpg', 'https://upload.wikimedia.org/wikipedia/commons/0/0a/67_-_Carthag%C3%A8ne_-_D%C3%A9cembre_2008.jpg', 'https://upload.wikimedia.org/wikipedia/commons/d/d2/A_Sa%C3%BAde_dos_Portos_%287110638275%29.jpg', 'https://upload.wikimedia.org/wikipedia/commons/0/0a/Actinidia_KIWI_02.jpg']"
Typhoon,A typhoon is a mature tropical cyclone that develops between 180° and 100°E in the Northern Hemisphere.,"['https://upload.wikimedia.org/wikipedia/commons/8/89/Cyclone_Catarina_from_the_ISS_on_March_26_2004.JPG', 'https://upload.wikimedia.org/wikipedia/commons/8/89/Depth26Cisotherm.png', 'https://upload.wikimedia.org/wikipedia/commons/a/a0/EF4DaltonMNtornadoJuly2020.png', 'https://upload.wikimedia.org/wikipedia/commons/8/83/Flag_of_Cambodia.svg', 'https://upload.wikimedia.org/wikipedia/commons/e/e4/Flag_of_the_Federated_States_of_Micronesia.svg']"
Medical imaging,"Medical imaging is the technique and process of imaging the interior of a body for clinical analysis and medical intervention, as well as visual representation of the function of some organs or tissues (physiology).","['https://upload.wikimedia.org/wikipedia/commons/c/c2/Abdominal_Ultrasound_General_Illustration.jpg', 'https://upload.wikimedia.org/wikipedia/commons/a/ad/CT_Scan_General_Illustration.jpg', 'https://upload.wikimedia.org/wikipedia/commons/4/4a/Commons-logo.svg', 'https://upload.wikimedia.org/wikipedia/commons/2/24/Derivative_of_medical_imaging.jpg', 'https://upload.wikimedia.org/wikipedia/commons/d/dc/Figure1TI.png']"
Biosphere,"The biosphere (from Greek βίος bíos ""life"" and σφαῖρα sphaira ""sphere""), also known as the ecosphere (from Greek οἶκος oîkos ""environment"" and σφαῖρα), is the worldwide sum of all ecosystems.","['https://upload.wikimedia.org/wikipedia/commons/2/2e/90_mile_beach.jpg', 'https://upload.wikimedia.org/wikipedia/commons/b/bf/Aegopodium_podagraria1_ies.jpg', 'https://upload.wikimedia.org/wikipedia/commons/a/aa/Biosphere_2_4888964549.jpg', 'https://upload.wikimedia.org/wikipedia/commons/4/4a/Commons-logo.svg', 'https://upload.wikimedia.org/wikipedia/commons/6/6a/Earth_Day_Flag.png']"
Melbourne Sea,Not found on Wikipedia,['Image not found']
Ore,"Ore is natural rock or sediment that contains one or more valuable minerals concentrated above background levels, typically containing metals, that can be mined, treated and sold at a profit.","['https://upload.wikimedia.org/wikipedia/commons/a/a3/Am%C3%A9thystre_sceptre2.jpg', 'https://upload.wikimedia.org/wikipedia/commons/2/2a/Anglesite-Galena-249200.jpg', 'https://upload.wikimedia.org/wikipedia/commons/3/31/Banded_iron_formation.png', 'https://upload.wikimedia.org/wikipedia/commons/9/9e/Classic_VMS_Deposit2.png', 'https://upload.wikimedia.org/wikipedia/commons/4/4a/Commons-logo.svg']"
Error detection and correction,"In information theory and coding theory with applications in computer science and telecommunication, error detection and correction (EDAC) or error control are techniques that enable reliable delivery of digital data over unreliable communication channels.","['https://upload.wikimedia.org/wikipedia/commons/9/99/Question_book-new.svg', 'https://upload.wikimedia.org/wikipedia/commons/e/ef/Reed%E2%80%93Solomon_error_correction_Mona_Lisa_LroLrLasercomFig4.jpg']"
Teeth,Not found on Wikipedia,['Image not found']
Nucleic acid,"Nucleic acids are biopolymers, macromolecules, essential to all known forms of life.","['https://upload.wikimedia.org/wikipedia/commons/3/37/Difference_DNA_RNA-EN.svg', 'https://upload.wikimedia.org/wikipedia/commons/b/bc/Friedrich_Miescher.jpg', 'https://upload.wikimedia.org/wikipedia/commons/2/2d/Issoria_lathonia.jpg', 'https://upload.wikimedia.org/wikipedia/commons/8/8a/OOjs_UI_icon_edit-ltr-progressive.svg', 'https://upload.wikimedia.org/wikipedia/commons/9/96/Symbol_category_class.svg']"
Orbit,"In celestial mechanics, an orbit is the curved trajectory of an object such as the trajectory of a planet around a star, or of a natural satellite around a planet, or of an artificial satellite around an object or position in space such as a planet, moon, asteroid, or Lagrange point.","['https://upload.wikimedia.org/wikipedia/commons/f/f4/Animation_of_C-2018_Y1_orbit_1600-2500.gif', 'https://upload.wikimedia.org/wikipedia/commons/4/4a/Commons-logo.svg', 'https://upload.wikimedia.org/wikipedia/commons/0/00/Crab_Nebula.jpg', 'https://upload.wikimedia.org/wikipedia/commons/5/5c/Earth-moon.jpg', 'https://upload.wikimedia.org/wikipedia/commons/5/5f/He1523a.jpg']"
Wildfire,"A wildfire, forest fire, bushfire, wildland fire or rural fire is an unplanned, uncontrolled and unpredictable fire in an area of combustible vegetation.","['https://upload.wikimedia.org/wikipedia/commons/5/5d/2009_California_Wildfires_at_JPL_-_Pasadena%2C_California.jpg', 'https://upload.wikimedia.org/wikipedia/commons/e/e2/2011-08-04_20_00_00_Susie_Fire_in_the_Adobe_Range_west_of_Elko_Nevada.jpg', 'https://upload.wikimedia.org/wikipedia/commons/3/36/ACTbushfire03.jpg', 'https://upload.wikimedia.org/wikipedia/commons/b/bf/Aegopodium_podagraria1_ies.jpg', 'https://upload.wikimedia.org/wikipedia/commons/0/0d/Air_pollution3.jpg']"
Adaptation,"In biology, adaptation has three related meanings.","['https://upload.wikimedia.org/wikipedia/commons/4/4a/Commons-logo.svg', 'https://upload.wikimedia.org/wikipedia/commons/a/ae/Darwin%27s_finches_by_Gould.jpg', 'https://upload.wikimedia.org/wikipedia/commons/6/67/Fitness-landscape-cartoon.png', 'https://upload.wikimedia.org/wikipedia/commons/2/2d/Issoria_lathonia.jpg', 'https://upload.wikimedia.org/wikipedia/commons/2/22/Lamarck%27s_Two-Factor_Theory.svg']"
Container,"A container is any receptacle or enclosure for holding a product used in storage, packaging, and transportation, including shipping.","['https://upload.wikimedia.org/wikipedia/commons/e/e0/8205Plastic_containers_03.jpg', 'https://upload.wikimedia.org/wikipedia/commons/4/4a/Commons-logo.svg', 'https://upload.wikimedia.org/wikipedia/commons/6/68/Little_world%2C_Aichi_prefecture_-_Main_exhibition_hall_-_Woven_basket_-_Maya_people_in_Mexico.jpg', 'https://upload.wikimedia.org/wikipedia/commons/3/3a/MOVINGBOX.JPG', 'https://upload.wikimedia.org/wikipedia/commons/8/8a/OOjs_UI_icon_edit-ltr-progressive.svg']"
Chemical component,Not found on Wikipedia,['Image not found']
Latin,Latin (lingua Latīna [ˈlɪŋɡʷa laˈtiːna] or Latīnum [laˈtiːnʊ̃]) is a classical language belonging to the Italic branch of the Indo-European languages.,"['https://upload.wikimedia.org/wikipedia/commons/5/5a/046CupolaSPietro.jpg', 'https://upload.wikimedia.org/wikipedia/commons/4/46/Calligraphy.malmesbury.bible.arp.jpg', 'https://upload.wikimedia.org/wikipedia/commons/0/02/Commentarii_de_Bello_Gallico.jpg', 'https://upload.wikimedia.org/wikipedia/commons/4/4a/Commons-logo.svg', 'https://upload.wikimedia.org/wikipedia/commons/3/33/Duenos_inscription.jpg']"
Technical fault,Not found on Wikipedia,['Image not found']
