Entity,Definition,Images
Stay outside,Not found on Wikipedia,['Image not found']
Smoke,"Smoke is a suspension of airborne particulates and gases emitted when a material undergoes combustion or pyrolysis, together with the quantity of air that is entrained or otherwise mixed into the mass.","['https://upload.wikimedia.org/wikipedia/commons/0/03/Bee_smoker02.jpg', 'https://upload.wikimedia.org/wikipedia/commons/2/24/Black_Fire_Smoke_during_a_Heat_Wvae.jpg', 'https://upload.wikimedia.org/wikipedia/commons/4/4a/Commons-logo.svg', 'https://upload.wikimedia.org/wikipedia/commons/7/79/Diesel-smoke.jpg', 'https://upload.wikimedia.org/wikipedia/commons/6/6e/Fish_processing_hub.jpg']"
Amazon rainforest,"The Amazon rainforest, also called Amazon jungle or Amazonia, is a moist broadleaf tropical rainforest in the Amazon biome that covers most of the Amazon basin of South America.","['https://upload.wikimedia.org/wikipedia/commons/9/90/2021_Top_ten_countries_for_tropical_primary_forest_loss_-_World_Resources_Institute.svg', 'https://upload.wikimedia.org/wikipedia/commons/0/0b/20220910_Amazon_deforestation_and_degradation%2C_by_country_-_Amazon_Watch.svg', 'https://upload.wikimedia.org/wikipedia/commons/e/e5/Afternoon_Clouds_over_the_Amazon_Rainforest.jpg', 'https://upload.wikimedia.org/wikipedia/commons/f/fa/Amazon14_%285641588550%29.jpg', 'https://upload.wikimedia.org/wikipedia/commons/7/73/Amazon_CIAT_%282%29.jpg']"
Alpha ray,Not found on Wikipedia,['Image not found']
Sodium chloride,"Sodium chloride , commonly known as salt (although sea salt also contains other chemical salts), is an ionic compound with the chemical formula NaCl, representing a 1:1 ratio of sodium and chloride ions.","['https://upload.wikimedia.org/wikipedia/commons/0/0f/Buckminsterfullerene-perspective-3D-balls.png', 'https://upload.wikimedia.org/wikipedia/commons/4/4a/Commons-logo.svg', 'https://upload.wikimedia.org/wikipedia/commons/0/00/Crab_Nebula.jpg', 'https://upload.wikimedia.org/wikipedia/commons/9/91/Dead-Sea---Salt-Evaporation-Ponds.jpg', 'https://upload.wikimedia.org/wikipedia/commons/5/5c/Earth-moon.jpg']"
Centrosome,"In cell biology, the centrosome (Latin centrum 'center' + Greek sōma 'body') (archaically cytocentre) is an organelle that serves as the main microtubule organizing center (MTOC) of the animal cell, as well as a regulator of cell-cycle progression.","['https://upload.wikimedia.org/wikipedia/commons/4/48/Animal_cell_structure_en.svg', 'https://upload.wikimedia.org/wikipedia/commons/f/fd/Centrosome_%28borderless_version%29-en.svg', 'https://upload.wikimedia.org/wikipedia/commons/3/35/Cytokinesis-electron-micrograph.jpg', 'https://upload.wikimedia.org/wikipedia/commons/9/9c/Molly_Sheehan_Wikipedia_1.jpg']"
Heavy rain,Not found on Wikipedia,['Image not found']
Research,"Research is ""creative and systematic work undertaken to increase the stock of knowledge"".","['https://upload.wikimedia.org/wikipedia/commons/f/f5/Alcator_C-Mod.jpg', 'https://upload.wikimedia.org/wikipedia/commons/b/bd/Ambox_current_red_Asia_Australia.svg', 'https://upload.wikimedia.org/wikipedia/commons/b/bd/Ambox_globe_content.svg', 'https://upload.wikimedia.org/wikipedia/commons/a/ae/Aristotle_Altemps_Inv8575.jpg', 'https://upload.wikimedia.org/wikipedia/commons/4/4a/Commons-logo.svg']"
Pumice powder,Not found on Wikipedia,['Image not found']
Bee,"Bees are winged insects closely related to wasps and ants, known for their roles in pollination and, in the case of the best-known bee species, the western honey bee, for producing honey.","['https://upload.wikimedia.org/wikipedia/commons/9/95/A_bee_covered_with_pollen.jpg', 'https://upload.wikimedia.org/wikipedia/commons/a/ad/Abeille_butineuse_et_son_pollen.JPG', 'https://upload.wikimedia.org/wikipedia/commons/b/b5/Amegilla_cingulata_on_long_tube_of_Acanthus_ilicifolius_flower.jpg', 'https://upload.wikimedia.org/wikipedia/commons/c/c4/Anthidium_February_2008-1.jpg', 'https://upload.wikimedia.org/wikipedia/commons/9/99/Apis_mellifera_flying.jpg']"
Scurvy,Scurvy is a disease resulting from a lack of vitamin C (ascorbic acid).,"['https://upload.wikimedia.org/wikipedia/commons/1/12/ASM-30-325-g001.jpg', 'https://upload.wikimedia.org/wikipedia/commons/d/db/ASM-30-325-g002.jpg', 'https://upload.wikimedia.org/wikipedia/commons/8/80/ASM-30-325-g003.jpg', 'https://upload.wikimedia.org/wikipedia/commons/c/c8/A_case_of_Scurvy_journal_of_Henry_Walsh_Mahon.jpg', 'https://upload.wikimedia.org/wikipedia/commons/4/4a/Commons-logo.svg']"
Earthquake science,Not found on Wikipedia,['Image not found']
Organic bone marrow,Not found on Wikipedia,['Image not found']
Lowercase,Not found on Wikipedia,['Image not found']
Sense,"A sense is a biological system used by an organism for sensation, the process of gathering information about the world through the detection of stimuli.","['https://upload.wikimedia.org/wikipedia/commons/6/65/1668_G%C3%A9rard_de_Lairesse_-_Allegory_of_the_Five_Senses.jpg', 'https://upload.wikimedia.org/wikipedia/commons/4/4a/Commons-logo.svg', 'https://upload.wikimedia.org/wikipedia/commons/f/f2/Edit-clear.svg', 'https://upload.wikimedia.org/wikipedia/commons/2/2d/Issoria_lathonia.jpg', 'https://upload.wikimedia.org/wikipedia/commons/8/8a/OOjs_UI_icon_edit-ltr-progressive.svg']"
Experience,"Experience refers to conscious events in general, more specifically to perceptions, or to the practical knowledge and familiarity that is produced by these processes.","['https://upload.wikimedia.org/wikipedia/commons/4/4a/Commons-logo.svg', 'https://upload.wikimedia.org/wikipedia/commons/8/8a/OOjs_UI_icon_edit-ltr-progressive.svg', 'https://upload.wikimedia.org/wikipedia/commons/c/cd/Socrates.png', 'https://upload.wikimedia.org/wikipedia/commons/9/96/Symbol_category_class.svg', 'https://upload.wikimedia.org/wikipedia/commons/f/fa/Wikiquote-logo.svg']"
Probability,"In science, the probability of an event is a number that indicates how likely the event is to occur.","['https://upload.wikimedia.org/wikipedia/commons/3/33/Bendixen_-_Carl_Friedrich_Gau%C3%9F%2C_1828.jpg', 'https://upload.wikimedia.org/wikipedia/commons/0/03/Cardano.jpg', 'https://upload.wikimedia.org/wikipedia/commons/a/a4/Christiaan_Huygens-painting.jpeg', 'https://upload.wikimedia.org/wikipedia/commons/4/4a/Commons-logo.svg', 'https://upload.wikimedia.org/wikipedia/commons/1/12/Dice_Distribution_%28bar%29.svg']"
Lighter,"A lighter is a portable device which creates a controlled flame, and can be used to ignite a variety of flammable items, such as cigarettes, butane gas, fireworks, candles or campfires.","['https://upload.wikimedia.org/wikipedia/commons/c/cb/Codex_Loeffelholz_F_27v_-_wheellock_-_rotated_90%C2%B0_CCW.png', 'https://upload.wikimedia.org/wikipedia/commons/4/4a/Commons-logo.svg', 'https://upload.wikimedia.org/wikipedia/commons/6/60/FRAD022_-_%22_Artisanat_de_tranch%C3%A9e_%22%2C_item_4.jpg', 'https://upload.wikimedia.org/wikipedia/commons/1/15/Hamburg_Museum_2010-1207-217.jpg', 'https://upload.wikimedia.org/wikipedia/commons/0/02/Lighter_diagram.PNG']"
Marsh,A marsh is a wetland that is dominated by herbaceous rather than woody plant species.,"['https://upload.wikimedia.org/wikipedia/commons/7/7e/Atchafalaya_Basin.jpg', 'https://upload.wikimedia.org/wikipedia/commons/4/4a/Commons-logo.svg', 'https://upload.wikimedia.org/wikipedia/commons/4/43/Culbin_Salt_Marsh_-_geograph.org.uk_-_185128.jpg', 'https://upload.wikimedia.org/wikipedia/commons/d/d8/Jyv%C3%A4skyl%C3%A4_-_swamp_2.jpg', 'https://upload.wikimedia.org/wikipedia/commons/0/03/MeadowInBigBear.JPG']"
Physical property,"A physical property is any property that is measurable, whose value describes a state of a physical system.","['https://upload.wikimedia.org/wikipedia/commons/8/8a/OOjs_UI_icon_edit-ltr-progressive.svg', 'https://upload.wikimedia.org/wikipedia/commons/9/99/Question_book-new.svg']"
Natural environment,"The natural environment or natural world encompasses all living and non-living things occurring naturally, meaning in this case not artificial.","['https://upload.wikimedia.org/wikipedia/commons/b/bf/Aegopodium_podagraria1_ies.jpg', 'https://upload.wikimedia.org/wikipedia/commons/b/b3/Ahja_j%C3%B5e_%C3%BCrgorg.jpg', 'https://upload.wikimedia.org/wikipedia/commons/a/a4/Air_pollution_by_industrial_chimneys.jpg', 'https://upload.wikimedia.org/wikipedia/commons/c/cb/Aletschgletsjer_Zwitserland.JPG', 'https://upload.wikimedia.org/wikipedia/commons/f/f5/Amazon_Rainforest-bird_site.jpg']"
Water vapor,"Water vapor, water vapour or aqueous vapor is the gaseous phase of water.","['https://upload.wikimedia.org/wikipedia/commons/4/4b/Above_the_Clouds.jpg', 'https://upload.wikimedia.org/wikipedia/commons/6/61/Artist%27s_Concept_of_Europa_Water_Vapor_Plume.jpg', 'https://upload.wikimedia.org/wikipedia/commons/1/15/Atmosphere_of_exoplanet.jpg', 'https://upload.wikimedia.org/wikipedia/commons/a/a0/Atmospheric_Water_Vapor_Mean.2005.030.jpg', 'https://upload.wikimedia.org/wikipedia/commons/a/a0/BAMS_climate_assess_boulder_water_vapor_2002_-_2.png']"
Europe,"Europe is a continent comprising the westernmost peninsulas of Eurasia, located entirely in the Northern Hemisphere and mostly in the Eastern Hemisphere.","['https://upload.wikimedia.org/wikipedia/commons/9/9d/1916_political_map_of_Europe.jpg', 'https://upload.wikimedia.org/wikipedia/commons/8/86/Africa_%28orthographic_projection%29.svg', 'https://upload.wikimedia.org/wikipedia/commons/9/9d/Afro-Eurasia_%28orthographic_projection%29_political.svg', 'https://upload.wikimedia.org/wikipedia/commons/8/8f/Alliances_militaires_en_Europe_1914-1918-fr.svg', 'https://upload.wikimedia.org/wikipedia/commons/c/ca/Americas_%28orthographic_projection%29.svg']"
Lipase,"Lipase ( LY-payss, LY-payz) is a family of enzymes that catalyzes the hydrolysis of fats.","['https://upload.wikimedia.org/wikipedia/commons/2/2d/Issoria_lathonia.jpg', 'https://upload.wikimedia.org/wikipedia/commons/b/b2/Lipase_PLRP2.png', 'https://upload.wikimedia.org/wikipedia/commons/8/8a/OOjs_UI_icon_edit-ltr-progressive.svg']"
Hydrogen,Hydrogen is the chemical element with the symbol H and atomic number 1.,"['https://upload.wikimedia.org/wikipedia/commons/0/09/19._%D0%95%D0%BA%D1%81%D0%BF%D0%BB%D0%BE%D0%B7%D0%B8%D1%98%D0%B0_%D0%BD%D0%B0_%D1%81%D0%BC%D0%B5%D1%81%D0%B0_%D0%BE%D0%B4_%D0%B2%D0%BE%D0%B4%D0%BE%D1%80%D0%BE%D0%B4_%D0%B8_%D0%B2%D0%BE%D0%B7%D0%B4%D1%83%D1%85.webm', 'https://upload.wikimedia.org/wikipedia/commons/f/fe/Antoine-Laurent_Lavoisier_%28by_Louis_Jean_Desire_Delaistre%29RENEW.jpg', 'https://upload.wikimedia.org/wikipedia/commons/1/1c/Blausen_0530_HydrogenIsotopes.png', 'https://upload.wikimedia.org/wikipedia/commons/4/4a/Commons-logo.svg', 'https://upload.wikimedia.org/wikipedia/commons/1/14/Crystal_energy.svg']"
Cake,"Cake is a flour confection made from flour, sugar, and other ingredients, and is usually baked.","['https://upload.wikimedia.org/wikipedia/commons/8/88/182365_Gooey_Butter_Cake.jpg', 'https://upload.wikimedia.org/wikipedia/commons/7/70/A_sheet_cake.jpg', 'https://upload.wikimedia.org/wikipedia/commons/1/1a/At_the_Seattle_Bridal_Show2.jpg', 'https://upload.wikimedia.org/wikipedia/commons/4/4f/Birthday_cake.jpg', 'https://upload.wikimedia.org/wikipedia/commons/1/11/Cake_Balls.jpg']"
Survival,"Survival, or the act of surviving, is the propensity of something to continue existing, particularly when this is done despite conditions that might kill or destroy it.","['https://upload.wikimedia.org/wikipedia/commons/4/44/Cobra_Gold_Jungle_Survival.jpg', 'https://upload.wikimedia.org/wikipedia/commons/4/4a/Commons-logo.svg', 'https://upload.wikimedia.org/wikipedia/commons/d/d8/Survival_outpost_in_Antarctica.jpg', 'https://upload.wikimedia.org/wikipedia/commons/d/d8/Survival_outpost_in_Antarctica.jpg', 'https://upload.wikimedia.org/wikipedia/commons/f/fa/Wikiquote-logo.svg']"
Irrigation,"Irrigation (also referred to as watering) is the practice of applying controlled amounts of water to land to help grow crops, landscape plants, and lawns.","['https://upload.wikimedia.org/wikipedia/commons/1/1b/Bisse.jpg', 'https://upload.wikimedia.org/wikipedia/commons/3/3d/Center-pivot_irrigation.jpg', 'https://upload.wikimedia.org/wikipedia/commons/2/27/Center_Pivot.jpg', 'https://upload.wikimedia.org/wikipedia/commons/3/34/Crop_Triangle_South_Africa.jpg', 'https://upload.wikimedia.org/wikipedia/commons/e/ef/Crop_sprinklers_Rio_Vista_California_15_Jul_2004-002.jpg']"
Red blood cell,"Red blood cells (RBCs), also referred to as red cells, red blood corpuscles (in humans or other animals not having nucleus in red blood cells), haematids, erythroid cells  or erythrocytes (from Greek erythros 'red' and kytos 'hollow vessel', with -cyte translated as 'cell' in modern usage), are the most common type of blood cell and the vertebrate's principal means of delivering oxygen (O2) to the body tissues—via blood flow through the circulatory system.","['https://upload.wikimedia.org/wikipedia/commons/1/1f/Anthonie_van_Leeuwenhoek_%281632-1723%29._Natuurkundige_te_Delft_Rijksmuseum_SK-A-957.jpeg', 'https://upload.wikimedia.org/wikipedia/commons/4/4a/Commons-logo.svg', 'https://upload.wikimedia.org/wikipedia/commons/6/68/Cytological_abnormalities_in_peripheral_blood_erythrocytes_of_penguins_Pygoscelis_papua_5.jpg', 'https://upload.wikimedia.org/wikipedia/commons/c/c1/Erythrocyte_Membrane_lipids.jpg', 'https://upload.wikimedia.org/wikipedia/commons/1/14/Erythrocytes_in_vertebrates.jpg']"
Underground storage,Not found on Wikipedia,['Image not found']
Night,"Night (also described as nighttime, unconventionally spelled as ""nite"") is the period of ambient darkness from sunset to sunrise during each 24-hour day, when the Sun is below the horizon.","['https://upload.wikimedia.org/wikipedia/commons/4/4a/Commons-logo.svg', 'https://upload.wikimedia.org/wikipedia/commons/0/00/Crab_Nebula.jpg', 'https://upload.wikimedia.org/wikipedia/commons/b/b5/Cumulus_clouds_in_fair_weather.jpeg', 'https://upload.wikimedia.org/wikipedia/commons/5/5c/Earth-moon.jpg', 'https://upload.wikimedia.org/wikipedia/commons/7/7f/En-Night-article.ogg']"
Mathematics,"Mathematics is an area of knowledge that includes the topics of numbers, formulas and related structures, shapes and the spaces in which they are contained, and quantities and their changes.","['https://upload.wikimedia.org/wikipedia/commons/b/bd/Ambox_globe_content.svg', 'https://upload.wikimedia.org/wikipedia/commons/5/58/Bakhshali_numerals_2.jpg', 'https://upload.wikimedia.org/wikipedia/commons/6/62/Cauchy_sequence_illustration.svg', 'https://upload.wikimedia.org/wikipedia/commons/4/4a/Commons-logo.svg', 'https://upload.wikimedia.org/wikipedia/commons/f/f2/Edit-clear.svg']"
Charge,Charge or charged may refer to:,"['https://upload.wikimedia.org/wikipedia/commons/5/5f/Disambig_gray.svg', 'https://upload.wikimedia.org/wikipedia/commons/9/99/Wiktionary-logo-en-v2.svg']"
Course,Course may refer to:,"['https://upload.wikimedia.org/wikipedia/commons/5/5f/Disambig_gray.svg', 'https://upload.wikimedia.org/wikipedia/commons/9/99/Wiktionary-logo-en-v2.svg']"
Stomata,Not found on Wikipedia,['Image not found']
Neutron,"The neutron is a subatomic particle, symbol n or n0, which has a neutral (not positive or negative) charge, and a mass slightly greater than that of a proton.","['https://upload.wikimedia.org/wikipedia/commons/a/aa/Beta-minus_Decay.svg', 'https://upload.wikimedia.org/wikipedia/commons/8/89/Beta_Negative_Decay.svg', 'https://upload.wikimedia.org/wikipedia/commons/2/2c/Blausen_0342_ElectronEnergyLevels.png', 'https://upload.wikimedia.org/wikipedia/commons/0/0d/Cold_Neutron_Source.jpg', 'https://upload.wikimedia.org/wikipedia/commons/4/4a/Commons-logo.svg']"
Functional group,"In organic chemistry, a functional group is a substituent or moiety in a molecule that causes the molecule's characteristic chemical reactions.","['https://upload.wikimedia.org/wikipedia/commons/9/92/1%C2%B0-amino-group.png', 'https://upload.wikimedia.org/wikipedia/commons/6/6c/2-APB.png', 'https://upload.wikimedia.org/wikipedia/commons/6/6d/2-pyridyl.svg', 'https://upload.wikimedia.org/wikipedia/commons/0/08/3-pyridyl.svg', 'https://upload.wikimedia.org/wikipedia/commons/2/2c/4-pyridyl.svg']"
Inhalation,Inhalation (or Inspiration) happens when air or other gases enter the lungs.,"['https://upload.wikimedia.org/wikipedia/commons/a/a7/Action_photo_of_nasal_spray_on_a_black_background.jpg', 'https://upload.wikimedia.org/wikipedia/commons/0/00/FlattenedRoundPills.jpg', 'https://upload.wikimedia.org/wikipedia/commons/9/98/Glycerin_suppositories.jpg', 'https://upload.wikimedia.org/wikipedia/commons/b/bf/Hexaaquatitanium%28III%29-solution.jpg', 'https://upload.wikimedia.org/wikipedia/commons/8/8e/Inhalation_diagram.svg']"
Flower,"A flower, sometimes known as a bloom or blossom, is the reproductive structure found in flowering plants (plants of the division Angiospermae).","['https://upload.wikimedia.org/wikipedia/commons/c/c5/15_Qian_Xuan_Eight_Flowers_National_Palace_Museum_Beijing.JPG', 'https://upload.wikimedia.org/wikipedia/commons/e/ee/ABC_flower_development.svg', 'https://upload.wikimedia.org/wikipedia/commons/5/55/Acaena_novae-zelandiae1.jpg', 'https://upload.wikimedia.org/wikipedia/commons/f/f9/Aikya_Linga_in_Varanasi.jpg', 'https://upload.wikimedia.org/wikipedia/commons/2/26/Amborella_trichopoda_%283065968016%29_fragment.jpg']"
Dense liquid,Not found on Wikipedia,['Image not found']
SARS-CoV-2,"Severe acute respiratory syndrome coronavirus 2 (SARS‑CoV‑2) is a strain of coronavirus that causes COVID-19 (coronavirus disease 2019), the respiratory illness responsible for the ongoing COVID-19 pandemic.","['https://upload.wikimedia.org/wikipedia/commons/1/13/6VSB_spike_protein_SARS-CoV-2_monomer_in_homotrimer.png', 'https://upload.wikimedia.org/wikipedia/commons/5/53/Ambox_current_red_Americas.svg', 'https://upload.wikimedia.org/wikipedia/commons/b/b4/Ambox_important.svg', 'https://upload.wikimedia.org/wikipedia/commons/4/4a/Commons-logo.svg', 'https://upload.wikimedia.org/wikipedia/commons/9/94/Coronavirus._SARS-CoV-2.png']"
Continental plate,Not found on Wikipedia,['Image not found']
Eating,"Eating (also known as consuming) is the ingestion of food, typically to provide a heterotrophic organism with  energy and to allow for growth.","['https://upload.wikimedia.org/wikipedia/commons/f/fb/A_polar_bear_%28Ursus_maritimus%29_scavenging_a_narwhal_whale_%28Monodon_monoceros%29_carcass_-_journal.pone.0060797.g001-A.png', 'https://upload.wikimedia.org/wikipedia/commons/2/28/Abell-photoblog28.jpg', 'https://upload.wikimedia.org/wikipedia/commons/2/29/Amandines_de_Provence%2C_poster_by_Leonetto_Cappiello%2C_1900.jpg', 'https://upload.wikimedia.org/wikipedia/commons/b/b4/BirdBeaksA.svg', 'https://upload.wikimedia.org/wikipedia/commons/4/4f/Blacky.jpg']"
91 Disasters Caused by Geo-natural Causes and Their Remedies,Not found on Wikipedia,['Image not found']
Petrol,Not found on Wikipedia,['https://upload.wikimedia.org/wikipedia/commons/1/1b/Semi-protection-shackle.svg']
Inorganic solid,Not found on Wikipedia,['Image not found']
Raw material,"A raw material, also known as a feedstock, unprocessed material, or primary commodity, is a basic material that is used to produce goods, finished goods, energy, or intermediate materials that are feedstock for future finished products.","['https://upload.wikimedia.org/wikipedia/commons/f/fa/AlbertaSulfurAtVancouverBC.jpg', 'https://upload.wikimedia.org/wikipedia/commons/4/49/Latex_-_Hevea_-_Cameroun.JPG', 'https://upload.wikimedia.org/wikipedia/commons/8/8a/OOjs_UI_icon_edit-ltr-progressive.svg', 'Image not found']"
Brain,A brain is an organ that serves as the center of the nervous system in all vertebrate and most invertebrate animals.,"['https://upload.wikimedia.org/wikipedia/commons/3/3a/1543%2C_Andreas_Vesalius%27_Fabrica%2C_Base_Of_The_Brain.jpg', 'https://upload.wikimedia.org/wikipedia/commons/c/c8/6_week_embryo_brain.jpg', 'https://upload.wikimedia.org/wikipedia/commons/3/3e/Basal_ganglia.svg', 'https://upload.wikimedia.org/wikipedia/commons/8/89/Bilaterian-plan.svg', 'https://upload.wikimedia.org/wikipedia/commons/a/ac/Brain-computer_interface_%28schematic%29.jpg']"
Greek alphabet,"The Greek alphabet has been used to write the Greek language since the late 9th or early 8th century BCE. It is derived from the earlier Phoenician alphabet, and was the earliest known alphabetic script to have distinct letters for vowels as well as consonants.","['https://upload.wikimedia.org/wikipedia/commons/5/52/Ancient_Greek_epichoric_alphabets.svg', 'https://upload.wikimedia.org/wikipedia/commons/4/4a/Commons-logo.svg', 'https://upload.wikimedia.org/wikipedia/commons/c/cd/Dipylon_Inscription.JPG', 'https://upload.wikimedia.org/wikipedia/commons/1/17/Ell-AlphabitosUpload.ogg', 'https://upload.wikimedia.org/wikipedia/commons/7/72/En-us-alpha.ogg']"
Mica,Micas ( MY-kəz) are a group of silicate minerals whose outstanding physical characteristic is that individual mica crystals can easily be split into extremely thin elastic plates.,"['https://upload.wikimedia.org/wikipedia/commons/a/a3/Am%C3%A9thystre_sceptre2.jpg', 'https://upload.wikimedia.org/wikipedia/commons/4/4a/Commons-logo.svg', 'https://upload.wikimedia.org/wikipedia/commons/9/9b/Dark_Mica_from_Eastern_Ontario.jpg', 'https://upload.wikimedia.org/wikipedia/commons/2/26/Hand_Hopewell_mica.jpg', 'https://upload.wikimedia.org/wikipedia/commons/6/68/Mica-moniale.jpg']"
Upper jaw,Not found on Wikipedia,['Image not found']
Algae cell,Not found on Wikipedia,['Image not found']
Conservation status,"The conservation status of a group of organisms (for instance, a species) indicates whether the group still exists and how likely the group is to become extinct in the near future.","['https://upload.wikimedia.org/wikipedia/commons/b/bf/Aegopodium_podagraria1_ies.jpg', 'https://upload.wikimedia.org/wikipedia/commons/5/5b/Bufo_periglenes2.jpg', 'https://upload.wikimedia.org/wikipedia/commons/6/6a/Earth_Day_Flag.png', 'https://upload.wikimedia.org/wikipedia/commons/4/42/Flickr_-_law_keven_-_How_much_longer_have_I_got_to_wait%5E.jpg', 'https://upload.wikimedia.org/wikipedia/commons/3/36/Hopetoun_falls.jpg']"
Severe acute respiratory syndrome,Not found on Wikipedia,['Image not found']
Food chain,"A food chain is a linear network of links in a food web starting from producer organisms (such as grass or algae which produce their own food via photosynthesis) and ending at an apex predator species (like grizzly bears or killer whales), detritivores (like earthworms or woodlice), or decomposer species (such as fungi or bacteria).","['https://upload.wikimedia.org/wikipedia/commons/0/0e/Chesapeake_Waterbird_Food_Web.jpg', 'https://upload.wikimedia.org/wikipedia/commons/6/6a/Earth_Day_Flag.png', 'https://upload.wikimedia.org/wikipedia/commons/f/f2/Edit-clear.svg', 'https://upload.wikimedia.org/wikipedia/commons/9/9f/Food_chain.png', 'https://upload.wikimedia.org/wikipedia/commons/a/aa/Merge-arrow.svg']"
Livestock,"Livestock are the domesticated animals raised in an agricultural setting to provide labor and produce diversified products for consumption such as meat, eggs, milk, fur, leather, and wool.","['https://upload.wikimedia.org/wikipedia/commons/e/e8/20150728_xl_P1000804_Leck_mich_Zaertlichkeit_der_Rinder.JPG', 'https://upload.wikimedia.org/wikipedia/commons/0/00/Animal_transport_6.jpg', 'https://upload.wikimedia.org/wikipedia/commons/1/18/Arjuna.jpg', 'https://upload.wikimedia.org/wikipedia/commons/1/15/BUFFALO159.JPG', 'https://upload.wikimedia.org/wikipedia/commons/5/56/Balinese_cow.JPG']"
Seed,"In botany, seed is an undeveloped plant embryo and food reserve enclosed in a protective outer covering called a seed coat (testa).","['https://upload.wikimedia.org/wikipedia/commons/4/4f/Budowa_nasienia-dwuliscienne.png', 'https://upload.wikimedia.org/wikipedia/commons/4/4a/Commons-logo.svg', 'https://upload.wikimedia.org/wikipedia/commons/b/b3/Comparison_of_Monocotyledons_and_Dicotyledons.png', 'https://upload.wikimedia.org/wikipedia/commons/7/77/Dycotyledon_seed_diagram-en.svg', 'https://upload.wikimedia.org/wikipedia/commons/b/bf/Female_coco_de_mer_seed.jpg']"
Ring of Fire,"The Ring of Fire (also known as the Pacific Ring of Fire, the Rim of Fire, the Girdle of Fire or the Circum-Pacific belt) is a region around much of the rim of the Pacific Ocean where many volcanic eruptions and earthquakes occur.","['https://upload.wikimedia.org/wikipedia/commons/c/ca/19991102_Tung_large.jpg', 'https://upload.wikimedia.org/wikipedia/commons/2/29/Active_Margin.svg', 'https://upload.wikimedia.org/wikipedia/commons/5/52/Antarctica_2013_Journey_to_the_Crystal_Desert_%288370600188%29.jpg', 'https://upload.wikimedia.org/wikipedia/commons/b/bd/Cascade_eruptions_in_the_last_4000_years.png', 'https://upload.wikimedia.org/wikipedia/commons/3/38/Cascadia_subduction_zone_USGS.png']"
Velocity,Velocity is the directional speed of an object in motion as an indication of its rate of change in position as observed from a particular frame of reference and as measured by a particular standard of time (e.g.,"['https://upload.wikimedia.org/wikipedia/commons/4/4a/Commons-logo.svg', 'https://upload.wikimedia.org/wikipedia/commons/9/98/Kinematics.svg', 'https://upload.wikimedia.org/wikipedia/commons/8/8a/OOjs_UI_icon_edit-ltr-progressive.svg', 'https://upload.wikimedia.org/wikipedia/commons/9/99/Question_book-new.svg', 'https://upload.wikimedia.org/wikipedia/commons/8/81/Radial_and_tangential.svg']"
