Entity,Definition,Images
Chemistry,Chemistry is the scientific study of the properties and behavior of matter.,"['https://upload.wikimedia.org/wikipedia/commons/8/80/Atom_Diagram.svg', 'https://upload.wikimedia.org/wikipedia/commons/2/2e/Benzene-2D-full.svg', 'https://upload.wikimedia.org/wikipedia/commons/0/05/Caffeine_%281%29_3D_ball.png', 'https://upload.wikimedia.org/wikipedia/commons/3/35/Carbon_dioxide_structure.png', 'https://upload.wikimedia.org/wikipedia/commons/e/e1/Chemicals_in_flasks.jpg']"
Tungro disease,Not found on Wikipedia,['Image not found']
Algal toxins,Not found on Wikipedia,['Image not found']
Tool,A tool is an object that can extend an individual's ability to modify features of the surrounding environment or help them accomplish a particular task.,"['https://upload.wikimedia.org/wikipedia/commons/5/5b/A_Bonobo_at_the_San_Diego_Zoo_%22fishing%22_for_termites.jpg', 'https://upload.wikimedia.org/wikipedia/commons/7/73/Bicycle_multi-tool.JPG', 'https://upload.wikimedia.org/wikipedia/commons/4/4a/Commons-logo.svg', 'https://upload.wikimedia.org/wikipedia/commons/4/41/Global_thinking.svg', 'https://upload.wikimedia.org/wikipedia/commons/d/db/MaryRose-carpentry_tools1.jpg']"
Melk,"Melk (German pronunciation: [mɛlk] (listen); older spelling: Mölk) is a city of Austria, in the federal state of Lower Austria, next to the Wachau valley along the Danube.","['https://upload.wikimedia.org/wikipedia/commons/1/13/AUT_Melk_COA.svg', 'https://upload.wikimedia.org/wikipedia/commons/c/c6/Austria_adm_location_map.svg', 'https://upload.wikimedia.org/wikipedia/commons/4/4a/Commons-logo.svg', 'https://upload.wikimedia.org/wikipedia/commons/b/b6/De-Melk.ogg', 'https://upload.wikimedia.org/wikipedia/commons/8/8a/Loudspeaker.svg']"
Body,Body may refer to:,"['https://upload.wikimedia.org/wikipedia/commons/5/5f/Disambig_gray.svg', 'https://upload.wikimedia.org/wikipedia/commons/1/1b/Semi-protection-shackle.svg', 'https://upload.wikimedia.org/wikipedia/commons/f/fa/Wikiquote-logo.svg', 'https://upload.wikimedia.org/wikipedia/commons/9/99/Wiktionary-logo-en-v2.svg']"
Telephone,A telephone is a telecommunications device that permits two or more users to conduct a conversation when they are too far apart to be easily heard directly.,"['https://upload.wikimedia.org/wikipedia/commons/1/15/1896_telephone.jpg', 'https://upload.wikimedia.org/wikipedia/commons/8/81/AT%26T_push_button_telephone_western_electric_model_2500_dmg_black.jpg', 'https://upload.wikimedia.org/wikipedia/commons/f/f4/Actor_portraying_Alexander_Graham_Bell_in_an_AT%26T_promotional_film_%281926%29.jpg', 'https://upload.wikimedia.org/wikipedia/commons/1/17/Alexander_Graham_Bell%27s_Telephone_Patent_Drawing_and_Oath_-_NARA_-_302052_%28page_2%29.jpg', 'https://upload.wikimedia.org/wikipedia/commons/1/16/Alexander_Graham_Telephone_in_Newyork.jpg']"
The Next Chapter,The Next Chapter may refer to:,['https://upload.wikimedia.org/wikipedia/commons/5/5f/Disambig_gray.svg']
Geo-engineering,Not found on Wikipedia,['Image not found']
Pure,Pure may refer to:,"['https://upload.wikimedia.org/wikipedia/commons/5/5f/Disambig_gray.svg', 'https://upload.wikimedia.org/wikipedia/commons/9/99/Wiktionary-logo-en-v2.svg']"
Natural gas,Natural gas (also called fossil gas or simply gas) is a naturally occurring mixture of gaseous hydrocarbons consisting primarily of methane in addition to various smaller amounts of other higher alkanes.,"['https://upload.wikimedia.org/wikipedia/commons/c/c4/1979-_Radiative_forcing_-_climate_change_-_global_warming_-_EPA_NOAA.svg', 'https://upload.wikimedia.org/wikipedia/commons/9/97/Aderklaa_-_Gasstation.JPG', 'https://upload.wikimedia.org/wikipedia/commons/b/bd/Ambox_current_red_Asia_Australia.svg', 'https://upload.wikimedia.org/wikipedia/commons/b/bd/Ambox_globe_content.svg', 'https://upload.wikimedia.org/wikipedia/commons/5/5d/BarnettShaleDrilling-9323.jpg']"
Heterophyte,Not found on Wikipedia,['Image not found']
Agaricus,"Agaricus is a genus of mushrooms containing both edible and poisonous species, with over 400 members worldwide and possibly again as many disputed or newly-discovered species.","['https://upload.wikimedia.org/wikipedia/commons/6/63/2012-07-09_Agaricus_subfloccosus_235732_crop.jpg', 'https://upload.wikimedia.org/wikipedia/commons/4/46/2013-10-01_Agaricus_merrilli_372340.jpg', 'https://upload.wikimedia.org/wikipedia/commons/8/84/2014-05-22_Cystoagaricus_trisulphuratus_%28Berk.%29_Singer_421894.jpg', 'https://upload.wikimedia.org/wikipedia/commons/8/8f/2017-08-08_Agaricus_rhoadsii_Murrill_768907.jpg', 'https://upload.wikimedia.org/wikipedia/commons/d/d7/Agaricus-campestris-michoacan.jpg']"
Respiration,Respiration may refer to:,"['https://upload.wikimedia.org/wikipedia/commons/5/5f/Disambig_gray.svg', 'https://upload.wikimedia.org/wikipedia/commons/9/99/Wiktionary-logo-en-v2.svg']"
Flight,"Flight or flying is the process by which an object moves through a space without contacting any planetary surface, either within an atmosphere (i.e.","['https://upload.wikimedia.org/wikipedia/commons/e/ee/Aeroforces.svg', 'https://upload.wikimedia.org/wikipedia/commons/e/ec/Aileron_pitch.gif', 'https://upload.wikimedia.org/wikipedia/commons/c/cc/Aileron_roll.gif', 'https://upload.wikimedia.org/wikipedia/commons/9/96/Aileron_yaw.gif', 'https://upload.wikimedia.org/wikipedia/commons/9/9c/Airfoil_lift_and_drag.svg']"
Flood,A flood is an overflow of water (or rarely other fluids) that submerges land that is usually dry.,"['https://upload.wikimedia.org/wikipedia/commons/d/d8/2foot_mud.jpg', 'https://upload.wikimedia.org/wikipedia/commons/e/e6/A_Flood_on_Java_1865-1876_Raden_Saleh.jpg', 'https://upload.wikimedia.org/wikipedia/commons/b/bf/Aegopodium_podagraria1_ies.jpg', 'https://upload.wikimedia.org/wikipedia/commons/2/25/Afghan_Air_Force_-_Jalalabad_Flood_Rescue_%284842784567%29.jpg', 'https://upload.wikimedia.org/wikipedia/commons/1/15/BDF0.jpg']"
Shorts,"Shorts are a garment worn over the pelvic area, circling the waist and splitting to cover the upper part of the legs, sometimes extending down to the knees but not covering the entire length of the leg.","['https://upload.wikimedia.org/wikipedia/commons/0/0e/Beach_boy_summer_time_2009.jpg', 'https://upload.wikimedia.org/wikipedia/commons/2/2b/Bebe_Hot_Pants_01_2008.jpg', 'https://upload.wikimedia.org/wikipedia/commons/4/4b/BoxerShorts-20070901.jpg', 'https://upload.wikimedia.org/wikipedia/commons/e/e2/Brazil_vs._Chile_in_Mineir%C3%A3o_05.jpg', 'https://upload.wikimedia.org/wikipedia/commons/3/30/Claude_Froidevaux_%281990%29_by_Erling_Mandelmann.jpg']"
Waterlogging,Waterlogging or water logging may refer to:,"['https://upload.wikimedia.org/wikipedia/commons/5/5f/Disambig_gray.svg', 'https://upload.wikimedia.org/wikipedia/commons/9/99/Wiktionary-logo-en-v2.svg']"
Natural phenomenon,Not found on Wikipedia,['Image not found']
Rectum,"The rectum is the final straight portion of the large intestine in humans and some other mammals, and the gut in others.","['https://upload.wikimedia.org/wikipedia/commons/2/26/Bisexuality_symbol_%28bold%2C_color%29.svg', 'https://upload.wikimedia.org/wikipedia/commons/e/e0/Digital_rectal_exam_nci-vol-7136-300.jpg', 'https://upload.wikimedia.org/wikipedia/commons/1/1f/Dogrectum400x3.jpg', 'https://upload.wikimedia.org/wikipedia/commons/b/ba/Dogrectum40x3.jpg', 'https://upload.wikimedia.org/wikipedia/commons/e/e9/Gray1083.png']"
Tremor,"A tremor is an involuntary, somewhat rhythmic, muscle contraction and relaxation involving oscillations or twitching movements of one or more body parts.","['https://upload.wikimedia.org/wikipedia/commons/4/4a/Commons-logo.svg', 'https://upload.wikimedia.org/wikipedia/commons/9/91/Writing_by_a_Parkinson%27s_disease_patient.png']"
Asteroid,An asteroid is a minor planet of the inner Solar System.,"['https://upload.wikimedia.org/wikipedia/commons/a/a3/2014_SR339_Arecibo.jpg', 'https://upload.wikimedia.org/wikipedia/commons/7/79/243_Ida_-_August_1993_%2816366655925%29.jpg', 'https://upload.wikimedia.org/wikipedia/commons/e/ef/42_of_the_largest_objects_in_the_asteroid_belt.jpg', 'https://upload.wikimedia.org/wikipedia/commons/b/bc/67P_Churyumov-Gerasimenko_-_Rosetta_%2832755885495%29.png', 'https://upload.wikimedia.org/wikipedia/commons/5/53/Animation_of_%28419624%29_2010_SO16_orbit.gif']"
Biochemical process,Not found on Wikipedia,['Image not found']
Cyst,"A cyst is a closed sac, having a distinct envelope and division compared with the nearby tissue.","['https://upload.wikimedia.org/wikipedia/commons/c/c9/Bronchogenic_cyst_high_mag.jpg', 'https://upload.wikimedia.org/wikipedia/commons/8/8a/OOjs_UI_icon_edit-ltr-progressive.svg', 'https://upload.wikimedia.org/wikipedia/commons/3/3e/Relative_incidence_of_odontogenic_cysts.jpg', 'https://upload.wikimedia.org/wikipedia/commons/c/c9/Relative_incidences_of_ovarian_cysts.jpg']"
Sulphur,Not found on Wikipedia,['Image not found']
Liquefaction,"In materials science, liquefaction is a process that generates a liquid from a solid or a gas or that generates a non-liquid phase which behaves in accordance with fluid dynamics.","['https://upload.wikimedia.org/wikipedia/commons/4/4a/Commons-logo.svg', 'https://upload.wikimedia.org/wikipedia/commons/b/b2/Liquefaction_on_roads_-_North_New_Brighton_centre_in_Christchurch_Feb_2011_quake.jpg', 'https://upload.wikimedia.org/wikipedia/commons/9/99/Wiktionary-logo-en-v2.svg']"
Feces,"Feces (or faeces), known colloquially and in slang as poo, caca, scat and poop, are the solid or semi-solid remains of food that was not digested in the small intestine, and has been broken down by bacteria in the large intestine.","['https://upload.wikimedia.org/wikipedia/commons/6/60/Avf%C3%B6ring_-_F%C3%A5gelspillning_-_Ystad-2015.jpg', 'https://upload.wikimedia.org/wikipedia/commons/1/18/Badaia_-_Heces_de_caballo_02.jpg', 'https://upload.wikimedia.org/wikipedia/commons/a/a8/BearApplePoop.JPG', 'https://upload.wikimedia.org/wikipedia/commons/4/4a/Commons-logo.svg', 'https://upload.wikimedia.org/wikipedia/commons/8/81/Cyclosia_papilionaris_by_Kadavoor.JPG']"
Pesticide,Pesticides are substances that are meant to control pests.,"['https://upload.wikimedia.org/wikipedia/commons/b/bf/Aegopodium_podagraria1_ies.jpg', 'https://upload.wikimedia.org/wikipedia/commons/d/d2/Cholinergic_synapse-de.svg', 'https://upload.wikimedia.org/wikipedia/commons/4/4a/Commons-logo.svg', 'https://upload.wikimedia.org/wikipedia/commons/5/5e/Cropduster_spraying_pesticides.jpg', 'https://upload.wikimedia.org/wikipedia/commons/6/6a/Earth_Day_Flag.png']"
Safe water,Not found on Wikipedia,['Image not found']
Firebox,Firebox may refer to:,"['https://upload.wikimedia.org/wikipedia/commons/5/5f/Disambig_gray.svg', 'https://upload.wikimedia.org/wikipedia/commons/9/99/Wiktionary-logo-en-v2.svg']"
Amoebic dysentery,Not found on Wikipedia,['Image not found']
The arts,"The arts are a range of human practices of creative expression, imagination and cultural participation for aesthetics or practical use.The arts can be divided into several areas: the fine arts which bring together, in the broad sense, all the arts whose main aim is to produce true aesthetic pleasure, decorative arts and applied arts which relate to an aesthetic side in everyday life.","['https://upload.wikimedia.org/wikipedia/commons/c/c3/45_record.png', 'https://upload.wikimedia.org/wikipedia/commons/3/35/Ac.parthenon5.jpg', 'https://upload.wikimedia.org/wikipedia/commons/c/cb/Catullus-at-Lesbia%27s-large.jpg', 'https://upload.wikimedia.org/wikipedia/commons/4/4a/Commons-logo.svg', 'https://upload.wikimedia.org/wikipedia/commons/f/f2/Edit-clear.svg']"
Atomic bombings of Hiroshima and Nagasaki,"On 6 and 9 August 1945, the United States detonated two atomic bombs over the Japanese cities of Hiroshima and Nagasaki, respectively.","['https://upload.wikimedia.org/wikipedia/commons/0/0b/%22Jap...You%27re_Next%5E_We%27ll_Finish_the_Job%22_-_NARA_-_513563.jpg', 'https://upload.wikimedia.org/wikipedia/commons/6/6a/1945-08-01JapWW2BattlefrontAtlas.jpg', 'https://upload.wikimedia.org/wikipedia/commons/2/23/21-01-198-hiroshima.jpg', 'https://upload.wikimedia.org/wikipedia/commons/7/7a/342-usaf-11034_Medical_Aspects-Hiroshima.webm', 'https://upload.wikimedia.org/wikipedia/commons/0/04/342-usaf-11075_Physical_Damage-Hiroshima.webm']"
Cooking,"Cooking, cookery, or culinary arts is the art, science and craft of using heat to improve the palatability, digestibility, nutrition, or safety of food.","['https://upload.wikimedia.org/wikipedia/commons/f/f8/Agdz-rosino-05.jpg', 'https://upload.wikimedia.org/wikipedia/commons/a/a7/BBQ_Food.jpg', 'https://upload.wikimedia.org/wikipedia/commons/4/4a/Commons-logo.svg', 'https://upload.wikimedia.org/wikipedia/commons/6/6e/Cooking_in_Villages.jpg', 'https://upload.wikimedia.org/wikipedia/commons/f/f3/Cuisson_des_pates.jpg']"
Intestinal juice,Not found on Wikipedia,['Image not found']
Loss of energy,Not found on Wikipedia,['Image not found']
Gram,The gram (originally gramme; SI unit symbol g) is a unit of mass in the International System of Units (SI) equal to one one thousandth of a kilogram.,"['https://upload.wikimedia.org/wikipedia/commons/7/7b/Gram_%28pen_cap_on_scale%29.jpg', 'https://upload.wikimedia.org/wikipedia/commons/8/8a/OOjs_UI_icon_edit-ltr-progressive.svg']"
Fever,"Fever, also referred to as pyrexia, is defined as having a temperature above the normal range due to an increase in the body's temperature set point.","['https://upload.wikimedia.org/wikipedia/commons/4/4a/Commons-logo.svg', 'https://upload.wikimedia.org/wikipedia/commons/f/f7/Fever-conceptual.svg', 'https://upload.wikimedia.org/wikipedia/commons/7/75/Fever_Patterns_v1.2.svg', 'https://upload.wikimedia.org/wikipedia/commons/b/be/Michael_Ancher_001.jpg', 'https://upload.wikimedia.org/wikipedia/commons/8/8a/OOjs_UI_icon_edit-ltr-progressive.svg']"
Organelle,"In cell biology, an organelle is a specialized subunit, usually within a cell, that has a specific function.","['https://upload.wikimedia.org/wikipedia/commons/1/11/Animal_Cell.svg', 'https://upload.wikimedia.org/wikipedia/commons/1/17/Brocadia_anammoxidans.jpg', 'https://upload.wikimedia.org/wikipedia/commons/f/f5/Carboxysomes_EM.jpg', 'https://upload.wikimedia.org/wikipedia/commons/4/4a/Commons-logo.svg', 'https://upload.wikimedia.org/wikipedia/commons/8/8a/OOjs_UI_icon_edit-ltr-progressive.svg']"
Digestive system,Not found on Wikipedia,['Image not found']
Technical education,Not found on Wikipedia,['Image not found']
Exercise,"Exercise is a body activity that enhances or maintains physical fitness and overall health and wellness.It is performed for various reasons, including weight loss or maintenance, to aid growth and improve strength, develop muscles and the cardiovascular system, hone athletic skills, improve health, or simply for enjoyment.","['https://upload.wikimedia.org/wikipedia/commons/2/2c/2018_USA_Indoor_Track_and_Field_Championships_%2840357948141%29.jpg', 'https://upload.wikimedia.org/wikipedia/commons/f/f6/Aerobic_Anaerobic_Exercise_Adaptations.jpg', 'https://upload.wikimedia.org/wikipedia/commons/4/4a/Commons-logo.svg', 'https://upload.wikimedia.org/wikipedia/commons/6/6a/Cristiano_Ronaldo_Iran_vs_Portugal.jpg', 'https://upload.wikimedia.org/wikipedia/commons/2/22/Cruising_on_a_Board.jpg']"
Tongue,The tongue is a muscular organ in the mouth of a typical tetrapod.,"['https://upload.wikimedia.org/wikipedia/commons/6/6c/1402_The_Tongue.jpg', 'https://upload.wikimedia.org/wikipedia/commons/1/10/Anatomy_posture_and_body_mechanics_08.web.jpg', 'https://upload.wikimedia.org/wikipedia/commons/4/4a/Commons-logo.svg', 'https://upload.wikimedia.org/wikipedia/commons/3/39/Dog_tongue.png', 'https://upload.wikimedia.org/wikipedia/commons/5/58/Facies_inferior_linguae.JPG']"
Storm,A storm is any disturbed state of the natural environment or the atmosphere of an astronomical body.,"['https://upload.wikimedia.org/wikipedia/commons/d/d1/Binger_Oklahoma_Tornado.jpg', 'https://upload.wikimedia.org/wikipedia/commons/a/a0/Blitze_IMGP6376_wp.jpg', 'https://upload.wikimedia.org/wikipedia/commons/2/27/Boat_in_storm_at_sea.jpg', 'https://upload.wikimedia.org/wikipedia/commons/2/26/Burning_Cross_Sunset_in_black_rain.jpg', 'https://upload.wikimedia.org/wikipedia/commons/7/76/Bwca_derecho.jpg']"
Volcanic pluton,Not found on Wikipedia,['Image not found']
Magma,Magma (from Ancient Greek  μάγμα (mágma) 'thick unguent') is the molten or semi-molten natural material from which all igneous rocks are formed.,"['https://upload.wikimedia.org/wikipedia/commons/6/6d/Diopside-anorthite_phase_diagram.png', 'https://upload.wikimedia.org/wikipedia/commons/7/79/Double_tet.png', 'https://upload.wikimedia.org/wikipedia/commons/0/06/Fractional_crystallization.svg', 'https://upload.wikimedia.org/wikipedia/commons/8/8a/OOjs_UI_icon_edit-ltr-progressive.svg', 'https://upload.wikimedia.org/wikipedia/commons/8/82/Pahoehoe_toe.jpg']"
Organism,"An organism (from Ancient Greek  ὄργανον (órganon) 'instrument, implement, tool', and  -ισμός (-ismós)) is any biological living system that functions as an individual life form.","['https://upload.wikimedia.org/wikipedia/commons/2/2e/Amoeba_%28Am%C3%B6be%29_01.jpg', 'https://upload.wikimedia.org/wikipedia/commons/8/83/Celltypes.svg', 'https://upload.wikimedia.org/wikipedia/commons/0/00/Crab_Nebula.jpg', 'https://upload.wikimedia.org/wikipedia/commons/e/e7/DNA_simple.svg', 'https://upload.wikimedia.org/wikipedia/commons/3/32/EscherichiaColi_NIAID.jpg']"
Water supply,"Water supply is the provision of water by public utilities, commercial organisations, community endeavors or by individuals, usually via a system of pumps and pipes.","['https://upload.wikimedia.org/wikipedia/commons/d/db/Africa_Watsan_7_%2810665637964%29.jpg', 'https://upload.wikimedia.org/wikipedia/commons/4/4a/Commons-logo.svg', 'https://upload.wikimedia.org/wikipedia/commons/7/79/Engine_room_at_water_works%3B_Toledo-O_-_DPLA_-_d3695416bfecbffd68f0268d56ea1f66_%28page_1%29.jpg', 'https://upload.wikimedia.org/wikipedia/commons/a/af/Model_of_pumping_engine_023.jpg', 'https://upload.wikimedia.org/wikipedia/commons/8/8a/OOjs_UI_icon_edit-ltr-progressive.svg']"
Cliff,"In geography and geology, a cliff is an area of rock which has a general angle defined by the vertical, or nearly vertical.","['https://upload.wikimedia.org/wikipedia/commons/4/48/Accreting_coast_Image6.svg', 'https://upload.wikimedia.org/wikipedia/commons/4/4c/Baffin_Island_Northeast_Coast_1997-08-07.jpg', 'https://upload.wikimedia.org/wikipedia/commons/4/4a/Commons-logo.svg', 'https://upload.wikimedia.org/wikipedia/commons/5/58/Fernando_noronha.jpg', 'https://upload.wikimedia.org/wikipedia/commons/d/d8/Ireland_cliffs_of_moher2.jpg']"
Copper,Copper is a chemical element with the symbol Cu (from Latin: cuprum) and atomic number 29.,"['https://upload.wikimedia.org/wikipedia/commons/f/f7/1953_Canadian_Dime_in_a_box_of_US_Dimes.jpg', 'https://upload.wikimedia.org/wikipedia/commons/e/e1/ARS_copper_rich_foods.jpg', 'https://upload.wikimedia.org/wikipedia/commons/3/3a/AngleseyCopperStream.jpg', 'https://upload.wikimedia.org/wikipedia/commons/8/8d/Busbars.jpg', 'https://upload.wikimedia.org/wikipedia/commons/7/7b/Chrysocolla_Timna_070613.jpg']"
Human digestive tract,Not found on Wikipedia,['Image not found']
Ethernet,"Ethernet () is a family of wired computer networking technologies commonly used in local area networks (LAN), metropolitan area networks (MAN) and wide area networks (WAN).","['https://upload.wikimedia.org/wikipedia/commons/4/40/10Base5transcievers.jpg', 'https://upload.wikimedia.org/wikipedia/commons/0/0d/Accton-etherpocket-sp-parallel-port-ethernet-adapter.jpg', 'https://upload.wikimedia.org/wikipedia/commons/2/24/An_Intel_82574L_Gigabit_Ethernet_NIC%2C_PCI_Express_x1_card.jpg', 'https://upload.wikimedia.org/wikipedia/commons/6/6f/Apple_Ethernet_Symbol.svg', 'https://upload.wikimedia.org/wikipedia/commons/9/9e/Bustopologie.png']"
Plastic recycling,Plastic recycling is  the processing of plastic waste into other products.,"['https://upload.wikimedia.org/wikipedia/commons/b/bf/Aegopodium_podagraria1_ies.jpg', 'https://upload.wikimedia.org/wikipedia/commons/6/63/Bales_of_PET_bottles.jpg', 'https://upload.wikimedia.org/wikipedia/commons/5/53/Bales_of_PET_bottles_stacked.jpg', 'https://upload.wikimedia.org/wikipedia/commons/4/4a/Commons-logo.svg', 'https://upload.wikimedia.org/wikipedia/commons/7/78/Definition_of_Free_Cultural_Works_logo_notext.svg']"
Gas to liquid,Not found on Wikipedia,['Image not found']
Chemical substance,A chemical substance is a form of matter having constant chemical composition and characteristic properties.,"['https://upload.wikimedia.org/wikipedia/commons/d/d5/Chemical_compounds.jpg', 'https://upload.wikimedia.org/wikipedia/commons/4/4a/Commons-logo.svg', 'https://upload.wikimedia.org/wikipedia/commons/f/fc/Ethanol-2D-skeletal.png', 'https://upload.wikimedia.org/wikipedia/commons/1/18/Kochendes_wasser02.jpg', 'https://upload.wikimedia.org/wikipedia/commons/9/96/Nile_red_01.jpg']"
Wooden furniture,Not found on Wikipedia,['Image not found']
Microbiology,"Microbiology (from Ancient Greek  μῑκρος (mīkros) 'small',  βίος (bíos) 'life', and  -λογία (-logía) 'study of') is the scientific study of microorganisms, those being unicellular (single cell), multicellular (cell colony), or acellular (lacking cells).","['https://upload.wikimedia.org/wikipedia/commons/9/93/Agar_plate_with_colonies.jpg', 'https://upload.wikimedia.org/wikipedia/commons/3/3c/Albert_Edelfelt_-_Louis_Pasteur_-_1885.jpg', 'https://upload.wikimedia.org/wikipedia/commons/1/1f/Anthonie_van_Leeuwenhoek_%281632-1723%29._Natuurkundige_te_Delft_Rijksmuseum_SK-A-957.jpeg', 'https://upload.wikimedia.org/wikipedia/commons/5/50/Avicenna_TajikistanP17-20Somoni-1999_%28cropped%29.png', 'https://upload.wikimedia.org/wikipedia/commons/4/4a/Commons-logo.svg']"
Microorganism,"A microorganism, or microbe, is an organism of microscopic size, which may exist in its single-celled form or as a colony of cells.","['https://upload.wikimedia.org/wikipedia/commons/3/3c/Albert_Edelfelt_-_Louis_Pasteur_-_1885.jpg', 'https://upload.wikimedia.org/wikipedia/commons/1/1f/Anthonie_van_Leeuwenhoek_%281632-1723%29._Natuurkundige_te_Delft_Rijksmuseum_SK-A-957.jpeg', 'https://upload.wikimedia.org/wikipedia/commons/c/ca/Biofermentor.jpeg', 'https://upload.wikimedia.org/wikipedia/commons/4/4a/Commons-logo.svg', 'https://upload.wikimedia.org/wikipedia/commons/e/e7/DNA_simple.svg']"
Flagella,Not found on Wikipedia,['Image not found']
Fly,"Flies are insects of the order Diptera, the name being derived from the Greek δι- di- ""two"", and πτερόν pteron ""wing"".","['https://upload.wikimedia.org/wikipedia/commons/e/e5/Acrocera_globulus.png', 'https://upload.wikimedia.org/wikipedia/commons/7/7e/Anopheles_stephensi.jpeg', 'https://upload.wikimedia.org/wikipedia/commons/b/bb/Anthomyiidae_%28female%29_%2810144905255%29.jpg', 'https://upload.wikimedia.org/wikipedia/commons/d/d9/Anthomyiidae_sp._1_%28aka%29.jpg', 'https://upload.wikimedia.org/wikipedia/commons/2/22/Asilidae_icon.jpg']"
Light bulb,Not found on Wikipedia,['Image not found']
Muhammad Zafar Iqbal,Not found on Wikipedia,['Image not found']
Science,"Science is a systematic endeavor that builds and organizes knowledge in the form of testable explanations and predictions about the universe.The earliest written records of identifiable predecessors to modern science come from Ancient Egypt and Mesopotamia from around 3000 to 1200 BCE. Their contributions to mathematics, astronomy, and medicine entered and shaped the Greek natural philosophy of classical antiquity, whereby formal attempts were made to provide explanations of events in the physical world based on natural causes.: 12  After the fall of the Western Roman Empire, knowledge of Greek conceptions of the world deteriorated in Western Europe during the early centuries (400 to 1000 CE) of the Middle Ages, but was preserved in the Muslim world during the Islamic Golden Age and later by the efforts of Byzantine Greek scholars who brought Greek manuscripts from the dying Byzantine Empire to Western Europe in the Renaissance.","['https://upload.wikimedia.org/wikipedia/commons/9/98/200_y_Anniversary_of_Berlin_Academy_1900.jpg', 'https://upload.wikimedia.org/wikipedia/commons/6/65/2021_Survey_on_existence_of_global_warming_and_responsibility_for_climate_change_-_bar_chart.svg', 'https://upload.wikimedia.org/wikipedia/commons/4/4f/Black_hole_-_Messier_87_crop_max_res.jpg', 'https://upload.wikimedia.org/wikipedia/commons/6/6f/CMB_Timeline300_no_WMAP.jpg', 'https://upload.wikimedia.org/wikipedia/commons/4/4a/Commons-logo.svg']"
Radio broadcasting,"Radio broadcasting is the broadcasting of audio (sound), sometimes with related metadata, by radio waves to radio receivers belonging to a public audience.","['https://upload.wikimedia.org/wikipedia/commons/8/8a/2006AM_broadcast_stations.PNG', 'https://upload.wikimedia.org/wikipedia/commons/e/ea/2006FM_broadcast_stations.PNG', 'https://upload.wikimedia.org/wikipedia/commons/8/8a/OOjs_UI_icon_edit-ltr-progressive.svg', 'https://upload.wikimedia.org/wikipedia/commons/9/99/Question_book-new.svg', 'https://upload.wikimedia.org/wikipedia/commons/a/a9/Radio_Libertaire_3.jpg']"
